{
  "$defs": {
    "failure_bucket": {
      "additionalProperties": false,
      "properties": {
        "count": {
          "minimum": 1,
          "type": "integer"
        },
        "failure_class": {
          "maxLength": 128,
          "minLength": 1,
          "type": "string"
        }
      },
      "required": [
        "failure_class",
        "count"
      ],
      "type": "object"
    },
    "student_model_identity": {
      "additionalProperties": false,
      "properties": {
        "checkpoint_id": {
          "maxLength": 512,
          "minLength": 1,
          "type": "string"
        },
        "harness_profile_id": {
          "maxLength": 512,
          "minLength": 1,
          "type": "string"
        },
        "model_id": {
          "maxLength": 512,
          "minLength": 1,
          "type": "string"
        },
        "sampling_identity": {
          "maxLength": 512,
          "minLength": 1,
          "type": "string"
        }
      },
      "required": [
        "model_id",
        "checkpoint_id",
        "harness_profile_id",
        "sampling_identity"
      ],
      "type": "object"
    }
  },
  "$id": "https://mstr.local/schemas/mstr-difficulty-calibration-v0.json",
  "$schema": "https://json-schema.org/draft/2020-12/schema",
  "additionalProperties": false,
  "properties": {
    "attempt_count": {
      "minimum": 1,
      "type": "integer"
    },
    "calibration_time": {
      "pattern": "^\\d{4}-\\d{2}-\\d{2}T\\d{2}:\\d{2}:\\d{2}Z$",
      "type": "string"
    },
    "difficulty_class": {
      "enum": [
        "TOO_EASY",
        "LEARNABLE_FRONTIER",
        "HARD_FRONTIER",
        "CURRENTLY_UNPRODUCTIVE",
        "INVALID"
      ]
    },
    "difficulty_record_identity": {
      "maxLength": 512,
      "minLength": 1,
      "type": "string"
    },
    "estimated_solve_probability": {
      "maximum": 1.0,
      "minimum": 0.0,
      "type": "number"
    },
    "failure_distribution": {
      "items": {
        "$ref": "#/$defs/failure_bucket"
      },
      "type": "array",
      "uniqueItems": true
    },
    "harness_profile_id": {
      "maxLength": 512,
      "minLength": 1,
      "type": "string"
    },
    "sampling_identity": {
      "maxLength": 512,
      "minLength": 1,
      "type": "string"
    },
    "schema_version": {
      "const": "mstr.difficulty-calibration.v0"
    },
    "structural_features": {
      "additionalProperties": {
        "type": [
          "string",
          "number",
          "boolean"
        ]
      },
      "minProperties": 1,
      "propertyNames": {
        "maxLength": 128,
        "minLength": 1
      },
      "type": "object"
    },
    "student_model_identity": {
      "$ref": "#/$defs/student_model_identity"
    },
    "success_count": {
      "minimum": 0,
      "type": "integer"
    },
    "task_or_family_id": {
      "maxLength": 512,
      "minLength": 1,
      "type": "string"
    }
  },
  "required": [
    "schema_version",
    "difficulty_record_identity",
    "task_or_family_id",
    "student_model_identity",
    "harness_profile_id",
    "sampling_identity",
    "attempt_count",
    "success_count",
    "estimated_solve_probability",
    "structural_features",
    "failure_distribution",
    "difficulty_class",
    "calibration_time"
  ],
  "title": "MSTR Difficulty Calibration v0",
  "type": "object"
}
